El Cartero de los Sueños; Cuentos infantiles
Un fantasma en apuros; cuentos infantiles
Max ya no hace referencia a cuentos infantil
Donde esta Alba?; Cuentos infantiles
Alba tiene una amiga muy especial; cuentos infantiles
Por una rosa; relatos; 
Mañana todavia. relatos 
El viaje del polizón; relatos; 
Relatos insólitos; relatos; 
Relatos de hoy II; relatos; 
Atlántico. 30 historias de los dos mundos
Historias para girar; relatos; 
Topito Terremoto; cuentos ilustrados
El Monstruo de Colores; cuentos ilustrados
El buit; cuentos ilustrados
Diario de las emociones; cuentos ilustrados
Te quiero (casi siempre); cuentos ilustrados
Si yo fuera un gato; Cuentos ilustrados
Mis opuestos; cuentos ilustrados
Mi mascota; cuentos; 
Tumaco; cuentos;
Cuando el mundo era como; cuentos
Mi primer libro de poesía colombiana; cuentos;
